{
  "schemaVersion": 1,
  "approvalId": "EXAMPLE-NOT-AN-APPROVAL",
  "models": [
    {
      "modelIdentifier": "mobileCLIP2",
      "sourceRevision": "72424e7025436db18f15c3eff6ee8c7c15ad4481",
      "approvedRuntimeSHA256": "0000000000000000000000000000000000000000000000000000000000000000",
      "reviewedLicenseFiles": ["MODEL_LICENSE.md"],
      "commercialRedistributionApproved": false,
      "obligations": ["Formal counsel review remains required"],
      "reviewer": "UNREVIEWED",
      "reviewDate": "1970-01-01",
      "approvalReference": "NONE",
      "replacementRequirement": "Replace the model if commercial redistribution is not approved."
    },
    {
      "modelIdentifier": "nudeNet",
      "sourceRevision": "3.4.2",
      "approvedRuntimeSHA256": "0000000000000000000000000000000000000000000000000000000000000000",
      "reviewedLicenseFiles": ["LICENSE", "LICENSE.md", "METADATA"],
      "commercialRedistributionApproved": false,
      "obligations": ["Resolve the MIT metadata versus bundled AGPL-3.0 conflict"],
      "reviewer": "UNREVIEWED",
      "reviewDate": "1970-01-01",
      "approvalReference": "NONE",
      "replacementRequirement": "Replace NudeNet with a commercially approved adapter-compatible model."
    },
    {
      "modelIdentifier": "personDetector",
      "sourceRevision": "419778480ab6ec0590e5d3831b3afb3b46ab2aa3",
      "approvedRuntimeSHA256": "0000000000000000000000000000000000000000000000000000000000000000",
      "reviewedLicenseFiles": ["YOLOX-CODE-LICENSE.txt"],
      "commercialRedistributionApproved": false,
      "obligations": ["Obtain a clear checkpoint redistribution statement"],
      "reviewer": "UNREVIEWED",
      "reviewDate": "1970-01-01",
      "approvalReference": "NONE",
      "replacementRequirement": "Replace the checkpoint while preserving the person-detector contract if approval is unavailable."
    }
  ],
  "signature": {
    "keyId": "NONE",
    "algorithm": "Ed25519",
    "signature": ""
  }
}
